{
  "$schema": "../../schemas/campaign.schema.json",
  "schemaVersion": 1,
  "contentVersion": "0.1.0",
  "id": "sleeping-citadel",
  "title": {
    "en": "The Sixty-Three Rooms Beneath the Sleeping Citadel",
    "ko": "잠든 성채 아래의 예순세 방"
  },
  "status": "design-complete-runtime-pending",
  "entryRoomId": "A01",
  "docs": {
    "overview": "docs/campaigns/sleeping-citadel-overview.md",
    "roomBible": "docs/campaigns/sleeping-citadel-room-bible.md",
    "assetInventory": "docs/assets/content-asset-inventory.md"
  },
  "runtimeRequirements": [
    "port-corridor-topology",
    "reserved-cell-movement",
    "settlement-capacity",
    "expedition-supplies",
    "physical-logistics",
    "territory-control",
    "construction-siege",
    "agent-personality-memory",
    "equipment-loot",
    "ecology-species-15-plus",
    "secret-connections",
    "room-state-variants"
  ],
  "zones": [
    {
      "id": "A",
      "name": { "en": "Surface Gate and Expedition Waystation", "ko": "지상 관문과 원정 안전지대" },
      "zoneKit": "zone.gate-waystation",
      "roomIds": ["A01", "A02", "A03", "A04", "A05"]
    },
    {
      "id": "B",
      "name": { "en": "Abandoned Residential Quarter", "ko": "버려진 주거구" },
      "zoneKit": "zone.residential-ruins",
      "roomIds": ["B06", "B07", "B08", "B09", "B10"]
    },
    {
      "id": "C",
      "name": { "en": "Flooded Storehouses", "ko": "침수된 저장 구역" },
      "zoneKit": "zone.flooded-storehouse",
      "roomIds": ["C11", "C12", "C13", "C14", "C15"]
    },
    {
      "id": "D",
      "name": { "en": "Industrial Corridor", "ko": "고블린·코볼트 산업 회랑" },
      "zoneKit": "zone.industrial-trapworks",
      "roomIds": ["D16", "D17", "D18", "D19", "D20"]
    },
    {
      "id": "E",
      "name": { "en": "Ossuary Cathedral", "ko": "납골 성당" },
      "zoneKit": "zone.ossuary-cathedral",
      "roomIds": ["E21", "E22", "E23", "E24", "E25"]
    },
    {
      "id": "F",
      "name": { "en": "Fungal Garden", "ko": "균류 정원" },
      "zoneKit": "zone.fungal-garden",
      "roomIds": ["F26", "F27", "F28", "F29", "F30"]
    },
    {
      "id": "G",
      "name": { "en": "Red-Silk Colony", "ko": "거미 수직 군락" },
      "zoneKit": "zone.spider-colony",
      "roomIds": ["G31", "G32", "G33", "G34", "G35"]
    },
    {
      "id": "H",
      "name": { "en": "Old Lantern Inn Ruins", "ko": "오래된 여관 폐허" },
      "zoneKit": "zone.old-lantern-inn",
      "roomIds": ["H36", "H37", "H38", "H39", "H40"]
    },
    {
      "id": "I",
      "name": { "en": "Central Cross-Market", "ko": "중앙 교차시장" },
      "zoneKit": "zone.central-market",
      "roomIds": ["I41", "I42", "I43", "I44", "I45"]
    },
    {
      "id": "J",
      "name": { "en": "Red-Tusk Barracks", "ko": "오크 병영과 투기장" },
      "zoneKit": "zone.orc-barracks",
      "roomIds": ["J46", "J47", "J48", "J49", "J50"]
    },
    {
      "id": "K",
      "name": { "en": "Sealed Royal Laboratory", "ko": "봉인 연구소" },
      "zoneKit": "zone.royal-laboratory",
      "roomIds": ["K51", "K52", "K53", "K54", "K55"]
    },
    {
      "id": "L",
      "name": { "en": "Deep Royal Quarter", "ko": "심층 왕실 구역" },
      "zoneKit": "zone.royal-deep",
      "roomIds": ["L56", "L57", "L58", "L59", "L60"]
    },
    {
      "id": "M",
      "name": { "en": "The Heart Sanctum", "ko": "최종 성소" },
      "zoneKit": "zone.heart-sanctum",
      "roomIds": ["M61", "M62", "M63"]
    }
  ],
  "rooms": [
    { "id": "A01", "zoneId": "A", "name": "Lantern Plaza", "kind": "safe-plaza", "size": [20, 16], "tags": ["entrance", "safe-zone", "resurrection", "water", "party-assembly"], "landmarkBundle": "waystation.plaza.core", "stateVariants": ["operational", "refugee-crowded", "expedition-suspended"] },
    { "id": "A02", "zoneId": "A", "name": "Expedition Registry", "kind": "registry", "size": [13, 10], "tags": ["party-generation", "contracts", "rumors", "class-unlock"], "landmarkBundle": "waystation.registry.office", "stateVariants": ["operational", "memorial", "inn-recruitment-office"] },
    { "id": "A03", "zoneId": "A", "name": "The Sealed Gate", "kind": "gate", "size": [18, 11], "tags": ["campaign-entry", "capacity-bottleneck", "siege-pressure"], "landmarkBundle": "gate.citadel.outer", "stateVariants": ["managed", "pressured", "supply-gateway"] },
    { "id": "A04", "zoneId": "A", "name": "Baggage Vault", "kind": "storehouse", "size": [14, 11], "tags": ["starting-equipment", "provisions", "repair", "rat-event"], "landmarkBundle": "waystation.baggage.store", "stateVariants": ["ordered", "overfilled", "raided"] },
    { "id": "A05", "zoneId": "A", "name": "Descent of Forty Lamps", "kind": "descent", "size": [12, 18], "tags": ["safe-boundary", "formation", "camera-landmark", "defense-line"], "landmarkBundle": "stairs.citadel.descent", "stateVariants": ["lit", "darkened", "fortified"] },

    { "id": "B06", "zoneId": "B", "name": "Broken Dormitory", "kind": "dormitory", "size": [17, 13], "tags": ["settlement-candidate", "beds", "rat-habitat", "salvage"], "landmarkBundle": "residential.dormitory.broken", "stateVariants": ["abandoned", "field-camp", "burned"] },
    { "id": "B07", "zoneId": "B", "name": "Communal Kitchen", "kind": "kitchen", "size": [15, 12], "tags": ["food", "cooking", "slime-risk", "settlement-support"], "landmarkBundle": "residential.kitchen.communal", "stateVariants": ["cold", "working", "infested"] },
    { "id": "B08", "zoneId": "B", "name": "Laundry Cistern", "kind": "water-room", "size": [16, 12], "tags": ["water", "camp-site", "secret-route", "contamination"], "landmarkBundle": "residential.laundry.cistern", "stateVariants": ["clear", "camped", "fungal-contaminated"] },
    { "id": "B09", "zoneId": "B", "name": "Tenement Court", "kind": "courtyard", "size": [19, 15], "tags": ["settlement-candidate", "market-candidate", "territory", "ambush"], "landmarkBundle": "residential.tenement.court", "stateVariants": ["empty", "occupied", "barricaded"] },
    { "id": "B10", "zoneId": "B", "name": "Household Chapel", "kind": "chapel", "size": [13, 11], "tags": ["sanctuary", "minor-healing", "undead-border", "story"], "landmarkBundle": "residential.chapel.household", "stateVariants": ["dormant", "reconsecrated", "defiled"] },

    { "id": "C11", "zoneId": "C", "name": "Shallow Reservoir", "kind": "reservoir", "size": [18, 14], "tags": ["water", "slime", "slow-movement", "sluice-control"], "landmarkBundle": "flooded.reservoir.shallow", "stateVariants": ["shallow", "drained", "overflowing"] },
    { "id": "C12", "zoneId": "C", "name": "Granary of Quiet Teeth", "kind": "granary", "size": [16, 13], "tags": ["food", "rat-warren", "cargo-source", "fire-risk"], "landmarkBundle": "flooded.granary.quiet-teeth", "stateVariants": ["sealed", "rat-dominated", "restored"] },
    { "id": "C13", "zoneId": "C", "name": "Flooded Wine Cellar", "kind": "cellar", "size": [17, 12], "tags": ["drink", "fungal-growth", "loot", "settlement-supply"], "landmarkBundle": "flooded.wine-cellar", "stateVariants": ["flooded", "drained", "fermenting-colony"] },
    { "id": "C14", "zoneId": "C", "name": "Drainage Engine Hall", "kind": "machinery", "size": [18, 14], "tags": ["water-control", "scrap", "kobold-interest", "route-state"], "landmarkBundle": "flooded.drainage.engine", "stateVariants": ["stalled", "operational", "sabotaged"] },
    { "id": "C15", "zoneId": "C", "name": "Sluice Passage", "kind": "passage", "size": [12, 20], "tags": ["route-control", "flood-hazard", "cargo-route", "secret-access"], "landmarkBundle": "flooded.sluice.passage", "stateVariants": ["open", "flooded", "fortified"] },

    { "id": "D16", "zoneId": "D", "name": "Abandoned Workshop", "kind": "workshop", "size": [17, 13], "tags": ["materials", "construction", "repair", "settlement-candidate"], "landmarkBundle": "industry.workshop.abandoned", "stateVariants": ["ruined", "reactivated", "exploded"] },
    { "id": "D17", "zoneId": "D", "name": "Iron Scrap Room", "kind": "scrap-yard", "size": [15, 12], "tags": ["scrap", "cargo-source", "kobold", "hazard"], "landmarkBundle": "industry.scrap.iron", "stateVariants": ["stocked", "stripped", "weaponized"] },
    { "id": "D18", "zoneId": "D", "name": "Copper-Tail Trapworks", "kind": "kobold-workshop", "size": [18, 14], "tags": ["kobold-settlement", "traps", "construction", "diplomacy"], "landmarkBundle": "industry.kobold.trapworks", "stateVariants": ["active", "allied", "destroyed"] },
    { "id": "D19", "zoneId": "D", "name": "Brass Button Market", "kind": "goblin-market", "size": [21, 16], "tags": ["goblin-settlement", "trade", "theft", "territory-hub"], "landmarkBundle": "industry.goblin.market", "stateVariants": ["goblin-market", "neutral-market", "orc-taxed", "burned"] },
    { "id": "D20", "zoneId": "D", "name": "Powder Magazine", "kind": "magazine", "size": [14, 12], "tags": ["explosive", "siege-resource", "route-change", "fire-risk"], "landmarkBundle": "industry.powder.magazine", "stateVariants": ["sealed", "looted", "detonated"] },

    { "id": "E21", "zoneId": "E", "name": "Bone Cloister", "kind": "cloister", "size": [18, 14], "tags": ["bones", "undead-patrol", "defensible", "story"], "landmarkBundle": "ossuary.cloister.bone", "stateVariants": ["silent", "undead-held", "reconsecrated"] },
    { "id": "E22", "zoneId": "E", "name": "Funeral Chapel", "kind": "funeral-chapel", "size": [17, 13], "tags": ["death-energy", "undead-settlement", "holy-conflict", "resurrection-research"], "landmarkBundle": "ossuary.chapel.funeral", "stateVariants": ["dormant", "choir-active", "purified"] },
    { "id": "E23", "zoneId": "E", "name": "Ossuary Shelves", "kind": "ossuary", "size": [19, 14], "tags": ["skeleton-spawn", "bones", "capacity", "cargo-source"], "landmarkBundle": "ossuary.shelves.working", "stateVariants": ["ordered", "spawning", "collapsed"] },
    { "id": "E24", "zoneId": "E", "name": "Nameless Tomb", "kind": "tomb", "size": [15, 13], "tags": ["rare-loot", "wraith", "story", "sealed"], "landmarkBundle": "ossuary.tomb.nameless", "stateVariants": ["sealed", "opened", "haunted"] },